,Libro,Autor,Sinopsis
80,"[[' '], ['\n            Ficha técnica de EL PUCHERO DE LAS MONJAS: RECETARIO DE SOR MARIA ISABEL\n          '], [' '], [' '], [' '], ['\n        Ficha técnica de EL PUCHERO DE LAS MONJAS: RECETARIO DE SOR MARIA ISABEL\n      '], [' '], ['Nº de páginas:'], [' '], ['320'], ['Editorial:'], [' '], ['MARTINEZ ROCA'], ['Idioma:'], [' '], ['CASTELLANO'], ['Encuadernación:'], [' '], ['Tapa blanda'], ['ISBN:'], [' '], ['9788427034860'], ['Año de edición:'], [' '], ['1999'], ['Plaza de edición:'], [' '], ['BARCELONA'], [' '], ['Fecha de lanzamiento:'], [' '], ['26/10/1999']]",Ferran Adria,"Oriol Castro, Eduard Xatruch y Mateu Casañas lideran desde su restaurante en Barcelona, la vanguardia de la gastronomía mundial con una decidida apuesta por la creatividad como seña de identidad. Por primera vez comparten, en esta obra, los secretos de su proyecto mas influyente con la publicacion de este primer volumen correspondiente al periodo 2014-2017. Disfrutar es la historia de uno de los restaurantes mas importantes de la culinaria moderna, un espacio singular con unos anfitriones que han creado escuela. Con todo detalle, se desgranan las claves de su cocina creativa, su evolucion y las tecnicas y conceptos que les han hecho celebres, desvelando abundante material inedito. Incluyendo un archivador que reproduce su metodologia perfectamente documentada, se muestra una seleccion de mas de 100 platos de su Catalogo 2014-2017. Algunas de sus creaciones mas famosas, paso a paso, con fotografias de su estrecho colaborador Francesc Guillamet."
81,"[[' '], ['\n            Ficha técnica de EL PUCHERO DE LAS MONJAS: RECETARIO DE SOR MARIA ISABEL\n          '], [' '], [' '], [' '], ['\n        Ficha técnica de EL PUCHERO DE LAS MONJAS: RECETARIO DE SOR MARIA ISABEL\n      '], [' '], ['Nº de páginas:'], [' '], ['320'], ['Editorial:'], [' '], ['MARTINEZ ROCA'], ['Idioma:'], [' '], ['CASTELLANO'], ['Encuadernación:'], [' '], ['Tapa blanda'], ['ISBN:'], [' '], ['9788427034860'], ['Año de edición:'], [' '], ['1999'], ['Plaza de edición:'], [' '], ['BARCELONA'], [' '], ['Fecha de lanzamiento:'], [' '], ['26/10/1999']]",Albert Adria,"Helena Attlee, distinguida experta en jardines, cayó bajo el hechizo de los cítricos hace diez años y desde entonces fue reuniendo materiales y dando forma a este delicioso libro. Con una inmensa sabiduria, delicadeza y sentido del humor la autora nos relata los origenes de los citricos, de la gastronomia y del pais, nos descubrelos secretos del arte de la horticultura y nos ofrece recetas tan sencillas como suculentas. Los aromas, los colores, las texturas, la luz y los paisajes que evoca son los hilos de una historia dorada donde civilizacion y naturaleza se reconcilian. Y asi El pais donde florece el limonero invita al lector a emprender un viaje unicoy fascinante a la Italia de ayer y de hoy."
82,"[[' '], ['\n            Ficha técnica de EL PUCHERO DE LAS MONJAS: RECETARIO DE SOR MARIA ISABEL\n          '], [' '], [' '], [' '], ['\n        Ficha técnica de EL PUCHERO DE LAS MONJAS: RECETARIO DE SOR MARIA ISABEL\n      '], [' '], ['Nº de páginas:'], [' '], ['320'], ['Editorial:'], [' '], ['MARTINEZ ROCA'], ['Idioma:'], [' '], ['CASTELLANO'], ['Encuadernación:'], [' '], ['Tapa blanda'], ['ISBN:'], [' '], ['9788427034860'], ['Año de edición:'], [' '], ['1999'], ['Plaza de edición:'], [' '], ['BARCELONA'], [' '], ['Fecha de lanzamiento:'], [' '], ['26/10/1999']]",Oriol Castro,"La nutricionista Blanca García-Orea nos descubre una forma  revolucionaria de alcanzar el bienestar emocional y físico: cuidar la microbiota intestinal.Muchas veces sufrimos cansancio, mal humor, ansiedad, estres e incluso  molestias digestivas que tratamos solo con medicamentos. Blanca Garcia-Orea, una de las nutricionistas mas influyentes en nuestro pais, comparte las claves para entender como influyen las bacterias intestinales en tus pensamientos, en tus patrones de conducta y su papel en las enfermedades y en la calidad de vida.La buena noticia es que la microbiota intestinal es modificable y,  aunque siempre hemos oido que nacemos con unos genes determinados que marcaran nuestro destino, ahora sabemos que, aunque tu codigo genetico sea desfavorable, si haces las cosas bien y sigues unos   buenos habitos de vida (buena alimentacion, ejercicio fisico, descansar  adecuadamente, no alcohol ni tabaco, etc.), no tienes por que sufrir determinadas enfermedades, aun teniendo predisposicion genetica a sufrirlas.EnDime que comes y te dire que bacteriastienes  encontraras pautas para mejorar tu microbiota intestinal en poco tiempo y consejos para leer etiquetas de algunos alimentos y saber cuales elegir. Tambien descubriras mas de 50 recetas sencillas y saludables para desayunos, meriendas, comidas, cenas, postres y panes, que te inspiraran y te ayudaran a ser el protagonista de tu salud fisica y mental.Ahora que empezamos a entender el leguaje que habla nuestro intestino, solo tenemos que seguirlo."
83,"[[' '], ['\n            Ficha técnica de EL PUCHERO DE LAS MONJAS: RECETARIO DE SOR MARIA ISABEL\n          '], [' '], [' '], [' '], ['\n        Ficha técnica de EL PUCHERO DE LAS MONJAS: RECETARIO DE SOR MARIA ISABEL\n      '], [' '], ['Nº de páginas:'], [' '], ['320'], ['Editorial:'], [' '], ['MARTINEZ ROCA'], ['Idioma:'], [' '], ['CASTELLANO'], ['Encuadernación:'], [' '], ['Tapa blanda'], ['ISBN:'], [' '], ['9788427034860'], ['Año de edición:'], [' '], ['1999'], ['Plaza de edición:'], [' '], ['BARCELONA'], [' '], ['Fecha de lanzamiento:'], [' '], ['26/10/1999']]",Mateu Casañas,"Recetas para toda la familia y adaptadas a intolerancias. Tras el exito de su libro anterior Dime que comes y te dire que bacterias tienes Blanca García-Orea propone 80 recetas nuevas,  fáciles de hacer en familia y adaptadas a intolerancias o ciertas  alergias, ademas de trucos para colocar y guardar los alimentos  correctamente en la nevera o consejos para las proporciones que deben  tener los distintos grupos de alimentos en nuestro plato. Tambien  aprenderas la diferencia entre grasas malas y buenas, mas trucos para  reducir el indice glucemico de los alimentos, como sustituir el azucar  de los platos, que alimentos debes tomar para alimentar a tu microbiota,  a planificar tu lista de la compra y tus menus semanales para omnivoros,  vegetarianos y adaptados a dietas bajas en FODMAPS, y mucho mas. Todo se  ha recogido de una forma sencilla y completa para que puedas sacarle el mayor partido y ¡comenzar hoy mismo a cuidarte! Otros libros de la autora:DIME QUE COMES Y TE DIRE QUE BACTERIAS TIENES SANOTES, SANITOS"
84,"[[' '], ['\n            Ficha técnica de EL PUCHERO DE LAS MONJAS: RECETARIO DE SOR MARIA ISABEL\n          '], [' '], [' '], [' '], ['\n        Ficha técnica de EL PUCHERO DE LAS MONJAS: RECETARIO DE SOR MARIA ISABEL\n      '], [' '], ['Nº de páginas:'], [' '], ['320'], ['Editorial:'], [' '], ['MARTINEZ ROCA'], ['Idioma:'], [' '], ['CASTELLANO'], ['Encuadernación:'], [' '], ['Tapa blanda'], ['ISBN:'], [' '], ['9788427034860'], ['Año de edición:'], [' '], ['1999'], ['Plaza de edición:'], [' '], ['BARCELONA'], [' '], ['Fecha de lanzamiento:'], [' '], ['26/10/1999']]",Eduard Xatruch,"La nutricionista Blanca García-Orea Haro, autora del éxito Dime qué comes y te diré qué bacterias tienes, nos presenta su primer cuento infantil, una herramienta indispensable para trabajar hábitos alimentarios saludables desde bien pequeños.¿Qué debo hacer para que mis bichitos estén sanotes, sanitos?A Valentina le duele mucho la tripa. Para ayudarla a descubrir por qué, su madre le cuenta que en su cuerpo hay bichitos buenos y malos, y que cuando come dulces o fritos, los malos montan un festín dentro de su barriga.Así, Valentina, junto a sus nuevos amigos los bichitos, se embarca en el gran viaje de la digestión para entender cómo funciona su cuerpo, qué les pasa a los alimentos que comemos y por qué las cacas son importantes.A los niños y niñas les encantará este libro porque:- Se divertirán junto a Valentina descubriendo curiosidades sobre el cuerpo humano.- Entenderán cómo tienen que alimentarse para que sus bichitos estén sanotes sanitos.- ¡Se sumergirán en el apasionante viaje del proceso digestivo!A las mamás y papás les será de gran utilidad para:- Trabajar hábitos alimentarios saludables con sus hijos.- Descubrir una forma revolucionaria de alcanzar el bienestar emocional y físico.- Entender cómo funciona el intestino, nuestro segundo cerebro."
85,"[[' '], ['\n            Ficha técnica de EL PUCHERO DE LAS MONJAS: RECETARIO DE SOR MARIA ISABEL\n          '], [' '], [' '], [' '], ['\n        Ficha técnica de EL PUCHERO DE LAS MONJAS: RECETARIO DE SOR MARIA ISABEL\n      '], [' '], ['Nº de páginas:'], [' '], ['320'], ['Editorial:'], [' '], ['MARTINEZ ROCA'], ['Idioma:'], [' '], ['CASTELLANO'], ['Encuadernación:'], [' '], ['Tapa blanda'], ['ISBN:'], [' '], ['9788427034860'], ['Año de edición:'], [' '], ['1999'], ['Plaza de edición:'], [' '], ['BARCELONA'], [' '], ['Fecha de lanzamiento:'], [' '], ['26/10/1999']]",Oriol Castro,"Recetas para toda la familia y adaptadas a intolerancias.Tras el éxito de su libro anteriorDime qué comes y te diré qué bacterias tienes Blanca García-Orea propone 80 recetas nuevas,  fáciles de hacer en familia y adaptadas a intolerancias o ciertas  alergias, ademas de trucos para colocar y guardar los alimentos  correctamente en la nevera o consejos para las proporciones que deben  tener los distintos grupos de alimentos en nuestro plato. Tambien  aprenderas la diferencia entre grasas malas y buenas, mas trucos para  reducir el indice glucemico de los alimentos, como sustituir el azucar  de los platos, que alimentos debes tomar para alimentar a tu microbiota,  a planificar tu lista de la compra y tus menus semanales para omnivoros,  vegetarianos y adaptados a dietas bajas en FODMAPS, y mucho mas. Todo se  ha recogido de una forma sencilla y completa para que puedas sacarle el mayor partido y ¡comenzar hoy mismo a cuidarte!Otros libros de la autora:DIME QUE COMES Y TE DIRE QUE BACTERIAS TIENESSANOTES, SANITOS"
86,"[[' '], ['\n            Ficha técnica de EL PUCHERO DE LAS MONJAS: RECETARIO DE SOR MARIA ISABEL\n          '], [' '], [' '], [' '], ['\n        Ficha técnica de EL PUCHERO DE LAS MONJAS: RECETARIO DE SOR MARIA ISABEL\n      '], [' '], ['Nº de páginas:'], [' '], ['320'], ['Editorial:'], [' '], ['MARTINEZ ROCA'], ['Idioma:'], [' '], ['CASTELLANO'], ['Encuadernación:'], [' '], ['Tapa blanda'], ['ISBN:'], [' '], ['9788427034860'], ['Año de edición:'], [' '], ['1999'], ['Plaza de edición:'], [' '], ['BARCELONA'], [' '], ['Fecha de lanzamiento:'], [' '], ['26/10/1999']]",Eduard Xatruc,"La nutricionista Blanca García-Orea nos descubre una forma  revolucionaria de alcanzar el bienestar emocional y físico: cuidar la microbiota intestinal.Muchas veces sufrimos cansancio, mal humor, ansiedad, estres e incluso  molestias digestivas que tratamos solo con medicamentos. Blanca Garcia-Orea, una de las nutricionistas mas influyentes en nuestro pais, comparte las claves para entender como influyen las bacterias intestinales en tus pensamientos, en tus patrones de conducta y su papel en las enfermedades y en la calidad de vida.La buena noticia es que la microbiota intestinal es modificable y,  aunque siempre hemos oido que nacemos con unos genes determinados que marcaran nuestro destino, ahora sabemos que, aunque tu codigo genetico sea desfavorable, si haces las cosas bien y sigues unos   buenos habitos de vida (buena alimentacion, ejercicio fisico, descansar  adecuadamente, no alcohol ni tabaco, etc.), no tienes por que sufrir determinadas enfermedades, aun teniendo predisposicion genetica a sufrirlas.EnDime que comes y te dire que bacteriastienes  encontraras pautas para mejorar tu microbiota intestinal en poco tiempo y consejos para leer etiquetas de algunos alimentos y saber cuales elegir. Tambien descubriras mas de 50 recetas sencillas y saludables para desayunos, meriendas, comidas, cenas, postres y panes, que te inspiraran y te ayudaran a ser el protagonista de tu salud fisica y mental.Ahora que empezamos a entender el leguaje que habla nuestro intestino, solo tenemos que seguirlo."
87,"[[' '], ['\n            Ficha técnica de EL PUCHERO DE LAS MONJAS: RECETARIO DE SOR MARIA ISABEL\n          '], [' '], [' '], [' '], ['\n        Ficha técnica de EL PUCHERO DE LAS MONJAS: RECETARIO DE SOR MARIA ISABEL\n      '], [' '], ['Nº de páginas:'], [' '], ['320'], ['Editorial:'], [' '], ['MARTINEZ ROCA'], ['Idioma:'], [' '], ['CASTELLANO'], ['Encuadernación:'], [' '], ['Tapa blanda'], ['ISBN:'], [' '], ['9788427034860'], ['Año de edición:'], [' '], ['1999'], ['Plaza de edición:'], [' '], ['BARCELONA'], [' '], ['Fecha de lanzamiento:'], [' '], ['26/10/1999']]",Mateu Casañas,"La nutricionista Blanca García-Orea Haro, autora de l'èxitDime qué comes y te diré qué bacterias tienes, presenta el seu primer  conte infantil, una eina indispensable per treballar habits alimentaris saludables des de ben petits.Què hem de fer per estar ben sanets?A la Valentina li fa molt mal la panxa. Per ajudar-la a descobrir per  què, la mare li explica que dins del cos hi tenim una mena d'animalons,  alguns de bons i altres de dolents, i que, quan menja llaminadures o  fregits, els dolents fan un bon tiberi i per això no es troba bé.La Valentina, juntament amb els seus nous amics els animalons, comen&ccedil;a el gran viatge de la digestió per entendre com funciona el cos, què els passa als aliments quan mengem i per què la caca és tan important.Als nens els fascinara aquest conte perquè:- Es divertiran juntament a la Valentina, descobrint curiositats sobre el cos.- Entendran com s'han d'alimentar perquè els seus animalons estiguin ben sanets.- Es submergiran dins l'apassionant viatge del procés digestiu.A mares i pares els hi resultara de gran utilitat per:- Treballar habits alimentaris saludables amb els seus fills- Descobrir una forma revolucionaria d'assolir el benestar emocional i físic.- Entendre com funciona l'intestí, el nostre segon cervell."
88,"[[' '], ['\n            Ficha técnica de EL PUCHERO DE LAS MONJAS: RECETARIO DE SOR MARIA ISABEL\n          '], [' '], [' '], [' '], ['\n        Ficha técnica de EL PUCHERO DE LAS MONJAS: RECETARIO DE SOR MARIA ISABEL\n      '], [' '], ['Nº de páginas:'], [' '], ['320'], ['Editorial:'], [' '], ['MARTINEZ ROCA'], ['Idioma:'], [' '], ['CASTELLANO'], ['Encuadernación:'], [' '], ['Tapa blanda'], ['ISBN:'], [' '], ['9788427034860'], ['Año de edición:'], [' '], ['1999'], ['Plaza de edición:'], [' '], ['BARCELONA'], [' '], ['Fecha de lanzamiento:'], [' '], ['26/10/1999']]",Oriol Castro,"¿Cuántas veces le han diagnosticado una enfermedad (cefaleas, hipotiroidismo, fibromialgia, depresión...), o se ha encontrado en una situación vital especial (premenstrual, embarazo, menopausia, senectud), y ha preguntado en la consulta ""¿Y  ahora que como, Doctor?"" Y, si algun experto en nutricion le da estas indicaciones.... ¿no ha llegado a casa y se ha encontrado que no sabe como cocinar o combinar estos alimentos que han sido indicados? ¿O le han recomendado comer sin lacteos o gluten y no sabe por donde empezar?. El libro responde a que comer, como cocinar y como combinar los alimentos que haran sentirse mejor. Es nas que una guia de alimentacion, sino una ""guia terapeutica de suplementos por patologias"" , asi como otros temas tan interesantes como: la dieta alcalina, la manera de realizar ayunos intermitentes, los superalimentos, o la importancia de las setas en la salud. Pero aun hay mas.no se limita a exponer que alimentacion es necesaria para cada patologia, se incluye un completo recetario comentado con sus propiedades nutricionales y terapeuticas que sin duda resulta muy util a quien quiera empezar a mantener o mejorar su salud a traves de alimentacion."
89,"[[' '], ['\n            Ficha técnica de EL PUCHERO DE LAS MONJAS: RECETARIO DE SOR MARIA ISABEL\n          '], [' '], [' '], [' '], ['\n        Ficha técnica de EL PUCHERO DE LAS MONJAS: RECETARIO DE SOR MARIA ISABEL\n      '], [' '], ['Nº de páginas:'], [' '], ['320'], ['Editorial:'], [' '], ['MARTINEZ ROCA'], ['Idioma:'], [' '], ['CASTELLANO'], ['Encuadernación:'], [' '], ['Tapa blanda'], ['ISBN:'], [' '], ['9788427034860'], ['Año de edición:'], [' '], ['1999'], ['Plaza de edición:'], [' '], ['BARCELONA'], [' '], ['Fecha de lanzamiento:'], [' '], ['26/10/1999']]",Eduard Xatruc,"La nutricionista Blanca García-Orea nos descubre una forma revolucionaria de alcanzar el bienestar emocional y físico: cuidar la microbiota intestinal.Muchas veces sufrimos cansancio, mal humor, ansiedad, estrés e incluso molestias digestivas que tratamos solo con medicamentos. Blanca García-Orea, una de las nutricionistas más influyentes en nuestro país, comparte las claves para entender cómo influyen las bacterias intestinales en tus pensamientos, en tus patrones de conducta y su papel en las enfermedades y en la calidad de vida.La buena noticia es que la microbiota intestinal es modificable y, aunque siempre hemos oído que nacemos con unos genes determinados que marcarán nuestro destino, ahora sabemos que, aunque tu código genético sea desfavorable, si haces las cosas bien y sigues unos buenos hábitos de vida (buena alimentación, ejercicio físico, descansar adecuadamente, no alcohol ni tabaco, etc.), no tienes por qué sufrir determinadas enfermedades, aun teniendo predisposición genética a sufrirlas.En Dime qué comes y te diré qué bacterias tienes encontrarás pautas para mejorar tu microbiota intestinal en poco tiempo y consejos para leer etiquetas de algunos alimentos y saber cuáles elegir. También descubrirás más de 50 recetas sencillas y saludables para desayunos, meriendas, comidas, cenas, postres y panes, que te inspirarán y te ayudarán a ser el protagonista de tu salud física y mental.Ahora que empezamos a entender el leguaje que habla nuestro intestino, solo tenemos que seguirlo."
90,"[[' '], ['\n            Ficha técnica de EL PUCHERO DE LAS MONJAS: RECETARIO DE SOR MARIA ISABEL\n          '], [' '], [' '], [' '], ['\n        Ficha técnica de EL PUCHERO DE LAS MONJAS: RECETARIO DE SOR MARIA ISABEL\n      '], [' '], ['Nº de páginas:'], [' '], ['320'], ['Editorial:'], [' '], ['MARTINEZ ROCA'], ['Idioma:'], [' '], ['CASTELLANO'], ['Encuadernación:'], [' '], ['Tapa blanda'], ['ISBN:'], [' '], ['9788427034860'], ['Año de edición:'], [' '], ['1999'], ['Plaza de edición:'], [' '], ['BARCELONA'], [' '], ['Fecha de lanzamiento:'], [' '], ['26/10/1999']]",Mateu Casañas,"@Blancanutri ha firmado 90 ejemplares en exclusiva para nuestros lectores, ¡llévatelo ya! (Unidades limitadas. Promoción válida hasta final de existencias).La nutricionista Blanca García-Orea Haro, autora del éxito Dime qué comes y te diré qué bacterias tienes, nos presenta su primer cuento infantil, una herramienta indispensable para trabajar hábitos alimentarios saludables desde bien pequeños.¿Qué debo hacer para que mis bichitos estén sanotes, sanitos?A Valentina le duele mucho la tripa. Para ayudarla a descubrir por qué, su madre le cuenta que en su cuerpo hay bichitos buenos y malos, y que cuando come dulces o fritos, los malos montan un festín dentro de su barriga.Así, Valentina, junto a sus nuevos amigos los bichitos, se embarca en el gran viaje de la digestión para entender cómo funciona su cuerpo, qué les pasa a los alimentos que comemos y por qué las cacas son importantes.A los niños y niñas les encantará este libro porque:- Se divertirán junto a Valentina descubriendo curiosidades sobre el cuerpo humano.- Entenderán cómo tienen que alimentarse para que sus bichitos estén sanotes sanitos.- ¡Se sumergirán en el apasionante viaje del proceso digestivo!A las mamás y papás les será de gran utilidad para:- Trabajar hábitos alimentarios saludables con sus hijos.- Descubrir una forma revolucionaria de alcanzar el bienestar emocional y físico.- Entender cómo funciona el intestino, nuestro segundo cerebro."
91,"[[' '], ['\n            Ficha técnica de EL PUCHERO DE LAS MONJAS: RECETARIO DE SOR MARIA ISABEL\n          '], [' '], [' '], [' '], ['\n        Ficha técnica de EL PUCHERO DE LAS MONJAS: RECETARIO DE SOR MARIA ISABEL\n      '], [' '], ['Nº de páginas:'], [' '], ['320'], ['Editorial:'], [' '], ['MARTINEZ ROCA'], ['Idioma:'], [' '], ['CASTELLANO'], ['Encuadernación:'], [' '], ['Tapa blanda'], ['ISBN:'], [' '], ['9788427034860'], ['Año de edición:'], [' '], ['1999'], ['Plaza de edición:'], [' '], ['BARCELONA'], [' '], ['Fecha de lanzamiento:'], [' '], ['26/10/1999']]",Oriol Castro,"El libro definitivo para todo amante de la cocina.Tanto si quieres sorprender a los tuyos como si necesitas incorporar ideas nuevas a tu menú diario, aquí vas encontrar recetas fantásticas con las que sin duda triunfaras.Las cocochas de bacalao al pilpil, el solomillo Wellington, el pastelitoeclair de chocolate y crema o el coctel margarita de fresa son algunos de los 100 platos imprescindibles que descubriras en este libro y que todo amante de la gastronomia deberia preparar por lo menos una vez en su vida."
92,"[[' '], ['\n            Ficha técnica de EL PUCHERO DE LAS MONJAS: RECETARIO DE SOR MARIA ISABEL\n          '], [' '], [' '], [' '], ['\n        Ficha técnica de EL PUCHERO DE LAS MONJAS: RECETARIO DE SOR MARIA ISABEL\n      '], [' '], ['Nº de páginas:'], [' '], ['320'], ['Editorial:'], [' '], ['MARTINEZ ROCA'], ['Idioma:'], [' '], ['CASTELLANO'], ['Encuadernación:'], [' '], ['Tapa blanda'], ['ISBN:'], [' '], ['9788427034860'], ['Año de edición:'], [' '], ['1999'], ['Plaza de edición:'], [' '], ['BARCELONA'], [' '], ['Fecha de lanzamiento:'], [' '], ['26/10/1999']]",Eduard Xatruc,"La Biblia de Maestros de la costura es el libro definitivo del talent de moda de más éxito de la televisión que cuenta con todo lo necesario para aprender a diseñar y confeccionar tus propias prendas.Con prácticos tutoriales y el paso a paso de las técnicas esenciales para que ningún elemento del arte de coser se te resista, incluye cinco de los mejores patrones del programa.La guía fundamental para llegar a convertirte en un virtuoso de la aguja."
93,"[[' '], ['\n            Ficha técnica de EL PUCHERO DE LAS MONJAS: RECETARIO DE SOR MARIA ISABEL\n          '], [' '], [' '], [' '], ['\n        Ficha técnica de EL PUCHERO DE LAS MONJAS: RECETARIO DE SOR MARIA ISABEL\n      '], [' '], ['Nº de páginas:'], [' '], ['320'], ['Editorial:'], [' '], ['MARTINEZ ROCA'], ['Idioma:'], [' '], ['CASTELLANO'], ['Encuadernación:'], [' '], ['Tapa blanda'], ['ISBN:'], [' '], ['9788427034860'], ['Año de edición:'], [' '], ['1999'], ['Plaza de edición:'], [' '], ['BARCELONA'], [' '], ['Fecha de lanzamiento:'], [' '], ['26/10/1999']]",Rafuel,"Diseñadora de joyas, influencer y gran emprendedora, Ana, la aspirante más joven de la octava temporada de MasterChef, ha demostrado también ser la más creativa, exigente y disciplinada.Si algo la ha caracterizado es su gran capacidad para trabajar en equipo y la delicadeza en sus presentaciones. En Las recetas de Ana encontrarás platos como foie con manzana y uvas, arroz caldero, codornices escabechadas o tarritos de chocolate, que harán las delicias de todos los amantes del talent show culinario de más éxito de la televisión."
94,"[[' '], ['\n            Ficha técnica de EL PUCHERO DE LAS MONJAS: RECETARIO DE SOR MARIA ISABEL\n          '], [' '], [' '], [' '], ['\n        Ficha técnica de EL PUCHERO DE LAS MONJAS: RECETARIO DE SOR MARIA ISABEL\n      '], [' '], ['Nº de páginas:'], [' '], ['320'], ['Editorial:'], [' '], ['MARTINEZ ROCA'], ['Idioma:'], [' '], ['CASTELLANO'], ['Encuadernación:'], [' '], ['Tapa blanda'], ['ISBN:'], [' '], ['9788427034860'], ['Año de edición:'], [' '], ['1999'], ['Plaza de edición:'], [' '], ['BARCELONA'], [' '], ['Fecha de lanzamiento:'], [' '], ['26/10/1999']]",Rafuel,"Cocina sana, sencilla y llena de sabor.EnLas recetas verdes de MasterChef encontrarás platos elaborados con una gran variedad de productos de temporada. Setenta sorprendentes y creativas recetas para que las protagonistas indiscutibles de tus menús sean las verduras, las hortalizas, las raíces, las hojas, las flores y las legumbres.Déjate seducir por este universo de coor que llenará tu cocina de sabores y olores. Comprobarás que con alimentos sencillos se pueden crear recetasgourmet.Porque lo saludable también es divertido, apúntate a la cocina verde deMasterChef."
95,"[[' '], ['\n            Ficha técnica de EL PUCHERO DE LAS MONJAS: RECETARIO DE SOR MARIA ISABEL\n          '], [' '], [' '], [' '], ['\n        Ficha técnica de EL PUCHERO DE LAS MONJAS: RECETARIO DE SOR MARIA ISABEL\n      '], [' '], ['Nº de páginas:'], [' '], ['320'], ['Editorial:'], [' '], ['MARTINEZ ROCA'], ['Idioma:'], [' '], ['CASTELLANO'], ['Encuadernación:'], [' '], ['Tapa blanda'], ['ISBN:'], [' '], ['9788427034860'], ['Año de edición:'], [' '], ['1999'], ['Plaza de edición:'], [' '], ['BARCELONA'], [' '], ['Fecha de lanzamiento:'], [' '], ['26/10/1999']]",Alma Obregon,"Diseñadora de joyas, influencer y gran emprendedora, Ana, la aspirante más joven de la octava temporada de MasterChef, ha demostrado también ser la más creativa, exigente y disciplinada.
Si algo la h"
