,Libro,Autor,Sinopsis
0,"[[' '], ['\n            Ficha técnica de EL GRAN LIBRO DE LA COCINA TRADICIONAL\n          '], [' '], [' '], [' '], ['\n        Ficha técnica de EL GRAN LIBRO DE LA COCINA TRADICIONAL\n      '], [' '], ['Nº de páginas:'], [' '], ['560'], ['Editorial:'], [' '], ['S.L.U. ESPASA LIBROS'], ['Idioma:'], [' '], ['CASTELLANO'], ['Encuadernación:'], [' '], ['Tapa dura'], ['ISBN:'], [' '], ['9788467046359'], ['Año de edición:'], [' '], ['2016'], ['Plaza de edición:'], [' '], ['ES'], [' '], ['Fecha de lanzamiento:'], [' '], ['08/03/2016']]",Margarita Carrillo Arronte,"La biblia de la comida casera mexicana.
México gastronomía es la biblia definitiva de la cocina casera mexicana. Con más de 600 auténticas recetas fáciles de seguir en nuestras casas. Desde sabrosos"
1,"[[' '], ['\n            Ficha técnica de EL GRAN LIBRO DE LA COCINA TRADICIONAL\n          '], [' '], [' '], [' '], ['\n        Ficha técnica de EL GRAN LIBRO DE LA COCINA TRADICIONAL\n      '], [' '], ['Nº de páginas:'], [' '], ['560'], ['Editorial:'], [' '], ['S.L.U. ESPASA LIBROS'], ['Idioma:'], [' '], ['CASTELLANO'], ['Encuadernación:'], [' '], ['Tapa dura'], ['ISBN:'], [' '], ['9788467046359'], ['Año de edición:'], [' '], ['2016'], ['Plaza de edición:'], [' '], ['ES'], [' '], ['Fecha de lanzamiento:'], [' '], ['08/03/2016']]",Chema Soler,"Las recetas de las mejores croquetas del mundo.Si te vuelven loco las croquetas, ¡este es tu libro!Creatividad, sabores y texturas en perfecta armonía. Una impecable fusión de ingredientes, ejecución y presentacion. Asi son las croquetas gourmet del genial chef Chema Soler.En este libro descubriras el mundocroquetil en todo su esplendor: croquetas pequeñas, delicadas, crujientes por fuera y cremosas por dentro y, sobre todo, sabrosas, muy sabrosas. Encontraras las de toda la vida con un toque diferente, pero sobre todo una seleccion de croquetas de autor originales, innovadoras y sorprendentes, desenfadadas, creativas y de fusion, como las de carabineros con kimchi, una explosion de cremosidad y sabor a mar con el toque picante y exotico del kimchi, las de sepia con su tinta gratinadas con alioli y gazpachuelo madrileño, una combinacion exquisita que sabe a gloria, o las de queso liquido con confitura de aceitunas y tomate, las unicas croquetas conocidas que se derriten literalmente en la boca y que, como el propio autor afirma, no hay palabras para definir la sensacion, hay que experimentarla. Tambien hay croquetas dulces, ¡de postre!, porquecasi todo escroquetizable. ¿Quien puede resistir la tentacion de probar unas deliciosas croquetas de tiramisu con gelatina de amaretto, por ejemplo?En definitiva, aqui descubriras todo un abanico de posibilidades para disfrutar en casa de las mas variadas, extraordinarias y sugerentes recetasgastrocroqueteras.Por fin, el libro que estabas esperando¡Que las disfrutes!"
2,"[[' '], ['\n            Ficha técnica de EL GRAN LIBRO DE LA COCINA TRADICIONAL\n          '], [' '], [' '], [' '], ['\n        Ficha técnica de EL GRAN LIBRO DE LA COCINA TRADICIONAL\n      '], [' '], ['Nº de páginas:'], [' '], ['560'], ['Editorial:'], [' '], ['S.L.U. ESPASA LIBROS'], ['Idioma:'], [' '], ['CASTELLANO'], ['Encuadernación:'], [' '], ['Tapa dura'], ['ISBN:'], [' '], ['9788467046359'], ['Año de edición:'], [' '], ['2016'], ['Plaza de edición:'], [' '], ['ES'], [' '], ['Fecha de lanzamiento:'], [' '], ['08/03/2016']]",Chema Soler,"Si te vuelven loco las croquetas, ¡este es tu libro!
Creatividad, sabores y texturas en perfecta armonía. Una impecable fusión de ingredientes, ejecución y presentación. Así son las croquetas gourmet"
3,"[[' '], ['\n            Ficha técnica de EL GRAN LIBRO DE LA COCINA TRADICIONAL\n          '], [' '], [' '], [' '], ['\n        Ficha técnica de EL GRAN LIBRO DE LA COCINA TRADICIONAL\n      '], [' '], ['Nº de páginas:'], [' '], ['560'], ['Editorial:'], [' '], ['S.L.U. ESPASA LIBROS'], ['Idioma:'], [' '], ['CASTELLANO'], ['Encuadernación:'], [' '], ['Tapa dura'], ['ISBN:'], [' '], ['9788467046359'], ['Año de edición:'], [' '], ['2016'], ['Plaza de edición:'], [' '], ['ES'], [' '], ['Fecha de lanzamiento:'], [' '], ['08/03/2016']]",Sor Maria Isabel,"El puchero de las monjas nos enseña a preparar ricos platos de una manera sencilla y eficazSabrosos garbanzos en su punto, tiernas lentejas, suculentas fabadas, apetitosos cocidos, deliciosas cremas de verduras, reconstituyentes caldos caseros, sopas frias y calientes, pasta al dente, jugosos arroces, nutritivos pures...El puchero de las monjas es un manual de cocina monacal tradicional, sencilla y sana, que proporciona una gran variedad de recetas faciles de hacer, contrastadas a lo largo de los años, y que resuelven tanto un menu individual como una comida familiar.Un libro nacido al calor de los fogones de un convento, que nos enseña a escoger los mejores ingredientes y nos descubre trucos y secretos para mejorar los platos de toda la vida.Quien cocina con amor, genera amor."
4,"[[' '], ['\n            Ficha técnica de EL GRAN LIBRO DE LA COCINA TRADICIONAL\n          '], [' '], [' '], [' '], ['\n        Ficha técnica de EL GRAN LIBRO DE LA COCINA TRADICIONAL\n      '], [' '], ['Nº de páginas:'], [' '], ['560'], ['Editorial:'], [' '], ['S.L.U. ESPASA LIBROS'], ['Idioma:'], [' '], ['CASTELLANO'], ['Encuadernación:'], [' '], ['Tapa dura'], ['ISBN:'], [' '], ['9788467046359'], ['Año de edición:'], [' '], ['2016'], ['Plaza de edición:'], [' '], ['ES'], [' '], ['Fecha de lanzamiento:'], [' '], ['08/03/2016']]",Sor Maria Isabel,"Sabrosos garbanzos en su punto, tiernas lentejas, suculentas fabadas, apetitosos cocidos, deliciosas cremas de verduras, reconstituyentes caldos caseros, sopas frías y calientes, pasta al dente, jugosos arroces, nutritivos pures...El puchero de las monjas es un manual de cocina monacal tradicional, sencilla y sana, que proporciona una gran variedad de recetas faciles de hacer, contrastadas a lo largo de los años, y que resuelven tanto un menu individual como una comida familiar.Un libro nacido al calor de los fogones de un convento, que nos enseña a escoger los mejores ingredientes y nos descubre trucos y secretos para mejorar los platos de toda la vida.Quien cocina con amor, genera amor."
5,"[[' '], ['\n            Ficha técnica de EL GRAN LIBRO DE LA COCINA TRADICIONAL\n          '], [' '], [' '], [' '], ['\n        Ficha técnica de EL GRAN LIBRO DE LA COCINA TRADICIONAL\n      '], [' '], ['Nº de páginas:'], [' '], ['560'], ['Editorial:'], [' '], ['S.L.U. ESPASA LIBROS'], ['Idioma:'], [' '], ['CASTELLANO'], ['Encuadernación:'], [' '], ['Tapa dura'], ['ISBN:'], [' '], ['9788467046359'], ['Año de edición:'], [' '], ['2016'], ['Plaza de edición:'], [' '], ['ES'], [' '], ['Fecha de lanzamiento:'], [' '], ['08/03/2016']]",Sor Maria Isabel,"Dorados buñuelos y torrijas, esponjosas magdalenas y bizcochos, crujientes rosquillas y galletas, turrones blandos y duros, sabrosas natillas y flanes... postres fáciles para cada día y especiales para fechas señaladas.Los dulces de las monjas recoge, con la sabiduria y buen hacer de la vida conventual, los sabores autenticos y tradicionales de la reposteria.Un practico libro que ademas de una gran variedad de postres, nos descubre trucos para ser mas habiles en la cocina, seleccionar la calidad de los mejores ingredientes, elaborar exquisitos complementos como sorbetes y licores y confeccionar deliciosas recetas dieteticas.Disfruta de las cosas sencillas, cocinando como los angeles."
6,"[[' '], ['\n            Ficha técnica de EL GRAN LIBRO DE LA COCINA TRADICIONAL\n          '], [' '], [' '], [' '], ['\n        Ficha técnica de EL GRAN LIBRO DE LA COCINA TRADICIONAL\n      '], [' '], ['Nº de páginas:'], [' '], ['560'], ['Editorial:'], [' '], ['S.L.U. ESPASA LIBROS'], ['Idioma:'], [' '], ['CASTELLANO'], ['Encuadernación:'], [' '], ['Tapa dura'], ['ISBN:'], [' '], ['9788467046359'], ['Año de edición:'], [' '], ['2016'], ['Plaza de edición:'], [' '], ['ES'], [' '], ['Fecha de lanzamiento:'], [' '], ['08/03/2016']]",Sor Maria Isabel,"Dorados buñuelos y torrijas, esponjosas magdalenas y bizcochos, crujientes rosquillas y galletas, turrones blandos y duros, sabrosas natillas y flanes... postres fáciles para cada día y especiales para fechas señaladas. Los dulces de las monjas recoge, con la sabiduría y buen hacer de la vida conventual, los sabores auténticos y tradicionales de la repostería. Un práctico libro que, además de una gran variedad de postres, nos descubre trucos para ser más hábiles en la cocina, seleccionar la calidad de los mejores ingredientes, elaborar exquisitos complementos, como sorbetes y licores, y confeccionar deliciosas recetas dietéticas. Disfruta de las cosas sencillas, cocinando como los ángeles. Su primera edición fue en noviembre de 1998 y tuvo gran éxito, alcanzando 18 ediciones con muy buenas ventas: más de 70.000 ejemplares vendidos.  Sor M.ª Isabel nos abre la puerta a los sabores auténticos y tradicionales de la repostería. Contiene más de 150 recetas. Nos enseña a escoger los mejores ingredientes y nos descubre trucos y secretos para ser más hábiles en la cocina.  Además sabremos también cuáles son los utensilios básicos que se tienen que tener en la repostería. Las equivalencias de pesos y medidas, y sugerencias para elegir los postres más adecuados para cada menú."
7,"[[' '], ['\n            Ficha técnica de EL GRAN LIBRO DE LA COCINA TRADICIONAL\n          '], [' '], [' '], [' '], ['\n        Ficha técnica de EL GRAN LIBRO DE LA COCINA TRADICIONAL\n      '], [' '], ['Nº de páginas:'], [' '], ['560'], ['Editorial:'], [' '], ['S.L.U. ESPASA LIBROS'], ['Idioma:'], [' '], ['CASTELLANO'], ['Encuadernación:'], [' '], ['Tapa dura'], ['ISBN:'], [' '], ['9788467046359'], ['Año de edición:'], [' '], ['2016'], ['Plaza de edición:'], [' '], ['ES'], [' '], ['Fecha de lanzamiento:'], [' '], ['08/03/2016']]",Beatriz Echeverria,"Beatriz Echeverría te enseña a hacer pan desde cero con un sistema sencillo e innovador. Aprenderás de forma intuitiva los principios fundamentales de la elaboración de pan en casa, incluso si tienes poco tiempo. Pan de masa madre, brioche, roscón, pan de centeno, panecillos, pan de espelta, integral, baguette, ciabatta italiana, pumpernickel&hellip; Descubre el placer de hacer pan en casa de la mano de una de las panaderas con más bagaje en formación."
8,"[[' '], ['\n            Ficha técnica de EL GRAN LIBRO DE LA COCINA TRADICIONAL\n          '], [' '], [' '], [' '], ['\n        Ficha técnica de EL GRAN LIBRO DE LA COCINA TRADICIONAL\n      '], [' '], ['Nº de páginas:'], [' '], ['560'], ['Editorial:'], [' '], ['S.L.U. ESPASA LIBROS'], ['Idioma:'], [' '], ['CASTELLANO'], ['Encuadernación:'], [' '], ['Tapa dura'], ['ISBN:'], [' '], ['9788467046359'], ['Año de edición:'], [' '], ['2016'], ['Plaza de edición:'], [' '], ['ES'], [' '], ['Fecha de lanzamiento:'], [' '], ['08/03/2016']]",Tim Anderson,"En Vegan Japaneasy, Tim Anderson comparte más de 80 recetas que resulta que son veganas en sí mismas, así que no es necesario usar aburridos sustitutivos ni quedarse a medias con el sabor. Desde clásicos como la tempura de verduras, los onigiri, las gyozas de setas o el agedashi tofu, hasta versiones modernas como el katsu de coliflor al curry, el ramen de cebolla o el mapo tofu, ni siquiera hace falta ser vegano para disfrutar con estos deliciosos platos. Añade a todo esto algunas fantasticas bebidas y postres como el mojito de sake y sandia o los brownies de butterscotch y salsa de soja?Y no vas a saber por donde empezar. Con ingredientes vegetales faciles de encontrar como el amargo miso, las setas ricas en umami o el acido ponzu, ¿quien necesita la carne o el pescado? Asi que, si eres novato en esto del veganismo, nuevo en la cocina japonesa, te inicias en ambas cosas, o si sencillamente quieres ampliar tu repertorio de platos sin el mundo animal, ¡este es tu libro!"
9,"[[' '], ['\n            Ficha técnica de EL GRAN LIBRO DE LA COCINA TRADICIONAL\n          '], [' '], [' '], [' '], ['\n        Ficha técnica de EL GRAN LIBRO DE LA COCINA TRADICIONAL\n      '], [' '], ['Nº de páginas:'], [' '], ['560'], ['Editorial:'], [' '], ['S.L.U. ESPASA LIBROS'], ['Idioma:'], [' '], ['CASTELLANO'], ['Encuadernación:'], [' '], ['Tapa dura'], ['ISBN:'], [' '], ['9788467046359'], ['Año de edición:'], [' '], ['2016'], ['Plaza de edición:'], [' '], ['ES'], [' '], ['Fecha de lanzamiento:'], [' '], ['08/03/2016']]",Tim Anderson,"Tokio es uno de los lugares más fascinantes del planeta. Un recorrido por las secciones alimentarias de los grandes almacenes, los restaurantes ubicados en las plantas altas de hoteles de lujo, y todos los establecimientos de pasta oriental, barras de sus"
10,"[[' '], ['\n            Ficha técnica de EL GRAN LIBRO DE LA COCINA TRADICIONAL\n          '], [' '], [' '], [' '], ['\n        Ficha técnica de EL GRAN LIBRO DE LA COCINA TRADICIONAL\n      '], [' '], ['Nº de páginas:'], [' '], ['560'], ['Editorial:'], [' '], ['S.L.U. ESPASA LIBROS'], ['Idioma:'], [' '], ['CASTELLANO'], ['Encuadernación:'], [' '], ['Tapa dura'], ['ISBN:'], [' '], ['9788467046359'], ['Año de edición:'], [' '], ['2016'], ['Plaza de edición:'], [' '], ['ES'], [' '], ['Fecha de lanzamiento:'], [' '], ['08/03/2016']]",Tim Anderson,"Más de 70 platos japoneses deliciosos y rápidos de elaborar.No me digas que no te fascina la comida japonesa. Lástima que sea tan complicado prepararla en casa, ¿no es cierto? Pues no, no es cierto.  Este libro revela que muchas recetas niponas no requieren ingredientes especializados y que se pueden preparar rapidamente con productos que se consiguen en el supermercado mas cercano.JapanEasy es una introduccion a la cocina del pais del sol naciente a traves de algunos de sus platos mas accesibles y, al mismo tiempo, mas autenticos: desde los sumamente apreciados, como los gyoza, el sushi, el yakitori, el ramen y la tempura, hasta las salsas y marinadas basicas que aportan un toque japones a cualquier comida. Las recetas se explican paso a paso y se indica su nivel de dificultad, con lo cual es sencillo seguirlas y mas sencillo aun que queden bien.Si querias encontrar platos japoneses faciles, rapidos de elaborar y deliciosos para preparar a menudo, no hace falta que sigas buscando: este libro es la mejor opcion."
11,"[[' '], ['\n            Ficha técnica de EL GRAN LIBRO DE LA COCINA TRADICIONAL\n          '], [' '], [' '], [' '], ['\n        Ficha técnica de EL GRAN LIBRO DE LA COCINA TRADICIONAL\n      '], [' '], ['Nº de páginas:'], [' '], ['560'], ['Editorial:'], [' '], ['S.L.U. ESPASA LIBROS'], ['Idioma:'], [' '], ['CASTELLANO'], ['Encuadernación:'], [' '], ['Tapa dura'], ['ISBN:'], [' '], ['9788467046359'], ['Año de edición:'], [' '], ['2016'], ['Plaza de edición:'], [' '], ['ES'], [' '], ['Fecha de lanzamiento:'], [' '], ['08/03/2016']]",Paola Freire,"Más de 75 recetas ineditas con ingredientes de temporada y un toque diferente y original. Paola Freire ha querido plasmar el día a día de su alimentación en  este libro y comparte con nosotros una gran variedad de recetas, todas ellas deliciosas. Aqui encontraremos aperitivos, guarniciones,  recetas dulces y platos principales cocinados con lo mejor de cada  estacion y con ingredientes que se pueden comprar con facilidad en los  mercados locales. Recetas que se elaboran con frutas, proteinas animales  y vegetales, legumbres, pastas, arroces, pero en las que, sobre todo, priman las verduras y hortalizas.  En palabras de la autora: ""El mejor consejo que os puedo dar es: La cocina es un placer, asi que ¡DISFRUTADLA! Eso es lo que he hecho yo  cocinando todas y cada una de las recetas que hoy comparto con vosotros  en este libro. A traves de ellas he querido haceros viajar por las  estaciones del año para ofreceros combinaciones diferentes preparadas  con ingredientes de siempre y de manera sencilla. Espero que descubrais  platos llenos de sabor y color en este libro y que se convierta en un basico en vuestra cocina."""
12,"[[' '], ['\n            Ficha técnica de EL GRAN LIBRO DE LA COCINA TRADICIONAL\n          '], [' '], [' '], [' '], ['\n        Ficha técnica de EL GRAN LIBRO DE LA COCINA TRADICIONAL\n      '], [' '], ['Nº de páginas:'], [' '], ['560'], ['Editorial:'], [' '], ['S.L.U. ESPASA LIBROS'], ['Idioma:'], [' '], ['CASTELLANO'], ['Encuadernación:'], [' '], ['Tapa dura'], ['ISBN:'], [' '], ['9788467046359'], ['Año de edición:'], [' '], ['2016'], ['Plaza de edición:'], [' '], ['ES'], [' '], ['Fecha de lanzamiento:'], [' '], ['08/03/2016']]",Paola Freire,"Más de 75 recetas con ingredientes de temporada y un toque diferente y original.La cocina es un placer ¡y hay que disfrutarla! Eso es lo que he  hecho yo cocinando todas y cada una de las recetas que hoy comparto con  vosotros en este libro: aperitivos, guarniciones, recetas dulces y  platos principales elaborados con lo mejor de cada estacion y con  ingredientes de siempre que se pueden comprar con facilidad en los  mercados locales. A traves de ellas he querido ofreceros combinaciones  diferentes elaboradas con frutas, proteinas animales y vegetales,  legumbres, pastas, arroces, pero en las que, sobre todo, priman las  verduras y hortalizas. Espero que descubrais platos llenos de sabor y  color que conviertan este libro en un basico de vuestra cocina."
13,"[[' '], ['\n            Ficha técnica de EL GRAN LIBRO DE LA COCINA TRADICIONAL\n          '], [' '], [' '], [' '], ['\n        Ficha técnica de EL GRAN LIBRO DE LA COCINA TRADICIONAL\n      '], [' '], ['Nº de páginas:'], [' '], ['560'], ['Editorial:'], [' '], ['S.L.U. ESPASA LIBROS'], ['Idioma:'], [' '], ['CASTELLANO'], ['Encuadernación:'], [' '], ['Tapa dura'], ['ISBN:'], [' '], ['9788467046359'], ['Año de edición:'], [' '], ['2016'], ['Plaza de edición:'], [' '], ['ES'], [' '], ['Fecha de lanzamiento:'], [' '], ['08/03/2016']]",Sergio Fernandez Luque,"Las 500 mejores recetas de toda lavida por el cocinero de TVE.El gran recetario de nuestra gastronomíade la mano del cocinero de TVE, SergioFernández. Más de 500 platos tradicionalesde la cocina española recogidos enel libro de recetas más completo. Aperitivos,arroces, legumbres, pescados,carnes, postres&hellip;todos los productos yalimentos están representados en estelibro. Recetas de platos sencillos con elsabor tradicional y con productos de latierra."
14,"[[' '], ['\n            Ficha técnica de EL GRAN LIBRO DE LA COCINA TRADICIONAL\n          '], [' '], [' '], [' '], ['\n        Ficha técnica de EL GRAN LIBRO DE LA COCINA TRADICIONAL\n      '], [' '], ['Nº de páginas:'], [' '], ['560'], ['Editorial:'], [' '], ['S.L.U. ESPASA LIBROS'], ['Idioma:'], [' '], ['CASTELLANO'], ['Encuadernación:'], [' '], ['Tapa dura'], ['ISBN:'], [' '], ['9788467046359'], ['Año de edición:'], [' '], ['2016'], ['Plaza de edición:'], [' '], ['ES'], [' '], ['Fecha de lanzamiento:'], [' '], ['08/03/2016']]",Sergio Fernandez Luque,"Sergio Fernández, el cocinero de TVE, rinde un merecido homenaje a la  riqueza y diversidad gastronómica de nuestro país.Un recetario ordenado por regiones que recupera nuestras tradiciones y sabores de siempre.Hace quince años que Sergio Fernandez viaja a lo largo y ancho de la  geografia española explorando y descubriendo los secretos mejor  guardados de cada cocina. Sabrosas carnes, pescados exquisitos, platos  de cuchara e infinidad de consejos se reunen en este libro para que tus  platos luzcan como nunca. Sencillo, practico, y organizado por regiones,  es un recetario imprescindible para los amantes de la cocina tradicional.En cada aldea, en cada plaza, en cada rincon, siempre encontre una  sorpresa, una sonrisa, un aroma y muchas ganas de compartir recuerdos,  tradiciones, trucos y recetas. Todos ellos han significado un viaje a los sabores con mas encanto de la vida.Sergio FernandezLa gastronomia española es un referente internacional que seduce dentro  y fuera de nuestras fronteras gracias a una generacion de chefs que ha  triunfado con sus propuestas innovadoras. Sin embargo, su exito no  habria sido posible sin una tradicion aprendida en los fogones mas  humildes, basada en platos transmitidos de generacion en generacion y considerados clasicos por su sencillez y honestidad a la hora de realzar los sabores de los alimentos regionales y de temporada.Pueblo a pueblo y receta a receta, Sergio Fernandez reune nuestros  sabores de siempre y rinde un merecido homenaje a la riqueza y diversidad gastronomica de nuestro pais."
15,"[[' '], ['\n            Ficha técnica de EL GRAN LIBRO DE LA COCINA TRADICIONAL\n          '], [' '], [' '], [' '], ['\n        Ficha técnica de EL GRAN LIBRO DE LA COCINA TRADICIONAL\n      '], [' '], ['Nº de páginas:'], [' '], ['560'], ['Editorial:'], [' '], ['S.L.U. ESPASA LIBROS'], ['Idioma:'], [' '], ['CASTELLANO'], ['Encuadernación:'], [' '], ['Tapa dura'], ['ISBN:'], [' '], ['9788467046359'], ['Año de edición:'], [' '], ['2016'], ['Plaza de edición:'], [' '], ['ES'], [' '], ['Fecha de lanzamiento:'], [' '], ['08/03/2016']]",Sergio Fernandez Luque,"En Cocina con Sergio Cupcakes encontrarás la manera de elaborar deliciosas recetas y originales decoraciones para cupcakes y cake pops: chocolate con menta, frutas, vainilla, crema de cacahuete... Pa"
16,"[[' '], ['\n            Ficha técnica de MEXICO. GASTRONOMÍA\n          '], [' '], [' '], [' '], ['\n        Ficha técnica de MEXICO. GASTRONOMÍA\n      '], [' '], ['Nº de páginas:'], [' '], ['704'], ['Editorial:'], [' '], ['PHAIDON PRESS LIMITED'], ['Idioma:'], [' '], ['CASTELLANO'], ['Encuadernación:'], [' '], ['Tapa dura'], ['ISBN:'], [' '], ['9780714870427'], ['Año de edición:'], [' '], ['2015'], ['Plaza de edición:'], [' '], ['Londres'], [' '], ['Fecha de lanzamiento:'], [' '], ['10/10/2015']]",Marilo Montero,"¿Qué te parecería preparar unas delicias de langostinos y eneldo, una crema fina de mejillones o unas trompetillas de pasta en salsa, por apenas un euro por persona? Con Saber cocinar recetas de lujo a precios mini , aprenderas a realizar excelentes platos pero asequibles a todos los bolsillos, a la vez que sencillos.Un nuevo recetario que te convertira en un anfitrion envidiable y por poco dinero."
17,"[[' '], ['\n            Ficha técnica de MEXICO. GASTRONOMÍA\n          '], [' '], [' '], [' '], ['\n        Ficha técnica de MEXICO. GASTRONOMÍA\n      '], [' '], ['Nº de páginas:'], [' '], ['704'], ['Editorial:'], [' '], ['PHAIDON PRESS LIMITED'], ['Idioma:'], [' '], ['CASTELLANO'], ['Encuadernación:'], [' '], ['Tapa dura'], ['ISBN:'], [' '], ['9780714870427'], ['Año de edición:'], [' '], ['2015'], ['Plaza de edición:'], [' '], ['Londres'], [' '], ['Fecha de lanzamiento:'], [' '], ['10/10/2015']]",Sergio Fernandez Luque,"¿Te gustaría sorprender a tus invitados con platos como una crema de cigalas y langostinos, un cordero a la sal o un solomillo de cerdo al hojaldre? ¿Y qué te parecería aprender a hacer postres tan deliciosos como pestiños a la miel, brownie con pistachos, mazapan artesano o trufas al ron y cafe?En este nuevo libro de cocina, Marilo Montero y Sergio Fernandez te ofrecen las recetas mas asombrosas a la vez que sencillas, ademas de un monton de trucos para decorar y presentar tus platos, haciendo las delicias de tus comensales."
18,"[[' '], ['\n            Ficha técnica de MEXICO. GASTRONOMÍA\n          '], [' '], [' '], [' '], ['\n        Ficha técnica de MEXICO. GASTRONOMÍA\n      '], [' '], ['Nº de páginas:'], [' '], ['704'], ['Editorial:'], [' '], ['PHAIDON PRESS LIMITED'], ['Idioma:'], [' '], ['CASTELLANO'], ['Encuadernación:'], [' '], ['Tapa dura'], ['ISBN:'], [' '], ['9780714870427'], ['Año de edición:'], [' '], ['2015'], ['Plaza de edición:'], [' '], ['Londres'], [' '], ['Fecha de lanzamiento:'], [' '], ['10/10/2015']]",Marilo Montero,"¿Te gustaría probar los garbanzos con gambas a la crema, calabacines rellenos de arroz, solomillo adobado con sandía a la plancha o raviolis con salsa de nueces? Pues ahora lo tienes a tu alcance. Si te gusta la cocina o por el contrario no sabes cocinar, este es tu libro. Marilo Montero y Sergio Fernandez te ofrecen las mejores recetas del programa Saber cocinar de La Mañana de la 1 de TVE. Con ellos aprenderas a realizar los platos mas sencillos, sanos, ricos y economicos, ademas de los diferentes metodos de cocinado y numerosos trucos con los que conseguiras resultados sorprendentes."
